<?xml version="1.0"?>
<!DOCTYPE Report
[
<!ELEMENT Report (General ,(Doc|BPT)) >
<!ATTLIST Report ver CDATA #REQUIRED tmZone CDATA #REQUIRED>

<!ELEMENT General ( DocLocation ) >
<!ATTLIST General productName CDATA #REQUIRED productVer CDATA #REQUIRED os CDATA #REQUIRED host CDATA #REQUIRED qcserver CDATA #IMPLIED qcproject CDATA #IMPLIED SolManSolutionId CDATA #IMPLIED SolManProjectId CDATA #IMPLIED SolManTestPlanId CDATA #IMPLIED SolManTestPackageId CDATA #IMPLIED SolManUserInfoData CDATA #IMPLIED  >

<!ELEMENT BPT (DName,Res,DVer?,TSet?,TInst?,NodeArgs,AdditionalInfo*,Doc*) >
<!ATTLIST BPT rID ID #REQUIRED >

<!ELEMENT Doc (DName,ConfName?,Res,DVer?,TSet?,TInst?,RunType?,DT?,AdditionalInfo*,Step*,DIter*,Step*,Action*,Doc*,Summary?,TestMaintenanceSummary*,NodeArgs?) >
<!ATTLIST Doc rID ID #REQUIRED type (Test|BC|BPTWrapperTest|Flow|Group|Action) "Test" productName CDATA #REQUIRED BCIter CDATA #IMPLIED >

<!ELEMENT RunType ( #PCDATA )>
<!ATTLIST RunType fmStep (False|True) "False" batch (False|True) "False" upDesc (False|True) "False" upChk (False|True) "False" upAS (False|True) "False">

<!ELEMENT DName ( #PCDATA ) >

<!ELEMENT ConfName ( #PCDATA ) >

<!ELEMENT Res ( #PCDATA ) >

<!ELEMENT AdditionalInfo (AdditionalDataName,AdditionalDataValue ) >

<!ELEMENT AdditionalDataName ( #PCDATA ) >

<!ELEMENT AdditionalDataValue ( #PCDATA ) >

<!ELEMENT DVer ( #PCDATA ) >

<!ELEMENT TSet ( #PCDATA ) >

<!ELEMENT TInst ( #PCDATA ) >

<!ELEMENT DIter (Step*,Action+,Summary?,NodeArgs)>
<!ATTLIST DIter rID ID #REQUIRED iterID CDATA #REQUIRED>

<!ELEMENT DocLocation ( #PCDATA )>

<!ELEMENT Action (AName,AIter*,(Step|HtmlStep|Action)*, Summary,ActionMaintenanceSummary*, NodeArgs ) >
<!ATTLIST Action rID ID #REQUIRED>

<!ELEMENT AIter ((Step|HtmlStep|Action)*,DataMapping?, Summary?,NodeArgs) >
<!ATTLIST AIter rID ID #REQUIRED iterID CDATA #REQUIRED isCountable (False|True) "False" >

<!ELEMENT AName ( #PCDATA ) >

<!ELEMENT TestMaintenanceSummary (ActionMaintenanceSummary*) >
<!ATTLIST TestMaintenanceSummary ObjectsAdded CDATA #REQUIRED ObjectsUpdated CDATA #REQUIRED StepsUpdated CDATA #REQUIRED StepsComments CDATA #REQUIRED><!ELEMENT ActionMaintenanceSummary (ObjectChange* ) >
<!ATTLIST ActionMaintenanceSummary Action CDATA #REQUIRED Objects CDATA #REQUIRED Updated CDATA #REQUIRED LinesTotal CDATA #REQUIRED Added CDATA #REQUIRED LinesUpdated CDATA #REQUIRED>

<!ELEMENT ObjectChange  (Hierarchy, PropertyChangeList* ) >
<!ATTLIST ObjectChange Operation CDATA #IMPLIED OriginalRepository CDATA #IMPLIED>

<!ELEMENT PropertyChangeList (PropertyDef*) >

<!ELEMENT PropertyDef (OriginalValue, NewValue) >
<!ATTLIST PropertyDef PropName CDATA #REQUIRED OriginRegularExpression (True|False) "False" NewRegularExpression (True|False) "False" AddedProperty (True|False) "False" >

<!ELEMENT OriginalValue ( #PCDATA )>

<!ELEMENT NewValue ( #PCDATA )>

<!ELEMENT Hierarchy  (ObjectName, Hierarchy*) >
<!ATTLIST Hierarchy MicClass CDATA #REQUIRED>

<!ELEMENT ObjectName  ( #PCDATA ) >

<!ELEMENT Step (Obj,Details,Time,TimeTick* ,(Step|HtmlStep|Doc)*, DataMapping?, NodeArgs) >
<!ATTLIST Step rID ID #REQUIRED retval CDATA #IMPLIED>

<!ELEMENT HtmlStep (HTML,TimeTick*,(Step|HtmlStep|Doc)*,NodeArgs) >
<!ATTLIST HtmlStep rID ID #REQUIRED >

<!ELEMENT Obj ( #PCDATA ) >
<!ATTLIST Obj plainTxt (False|True) "True">

<!ELEMENT Details ( #PCDATA ) >
<!ATTLIST Details plainTxt (False|True) "True">

<!ELEMENT Time ( #PCDATA ) >

<!ELEMENT HTML ( #PCDATA ) >

<!ELEMENT Disp ( #PCDATA ) >

<!ELEMENT TimeTick ( #PCDATA ) >

<!ELEMENT DataMapping ( DataMappedItem* )>
<!ELEMENT DataMappedItem EMPTY >
<!ATTLIST DataMappedItem dsName CDATA #REQUIRED >
<!ATTLIST DataMappedItem rowId CDATA #REQUIRED >

<!ELEMENT NodeArgs (Disp,TopPane?,BtmPane?,ExtendedInfo? )>
<!ATTLIST NodeArgs eType CDATA #REQUIRED icon CDATA #REQUIRED nRep CDATA #REQUIRED UserNote CDATA #IMPLIED filter (False|True) "True">
<!ATTLIST NodeArgs status (Passed|Failed|Done|Warning|Information) "Done">
<!ATTLIST NodeArgs iconSel CDATA #IMPLIED nType CDATA #IMPLIED MovieMarker CDATA "">
<!ATTLIST NodeArgs Source CDATA #IMPLIED SourceLine CDATA #IMPLIED StepFlowItemKey CDATA #IMPLIED >

<!ELEMENT TopPane (Path)>

<!ELEMENT BtmPane ( (Path|WR)?,ASHilite?)>
<!ATTLIST BtmPane vType CDATA "HTML">

<!ELEMENT Path ( #PCDATA ) >

<!ELEMENT ASHilite ( #PCDATA ) >

<!ELEMENT WR ( #PCDATA ) >

<!ELEMENT ExtendedInfo ( StepData ) >

<!ATTLIST ExtendedInfo StepType CDATA #REQUIRED>
<!ELEMENT DT (NodeArgs) >
<!ATTLIST DT rID ID #REQUIRED>

<!ELEMENT Summary (Param*)>
<!ATTLIST Summary sTime CDATA #IMPLIED eTime CDATA #IMPLIED passed CDATA #IMPLIED failed CDATA #IMPLIED warnings CDATA #IMPLIED retval CDATA #IMPLIED stopped (False|True) "False" >

<!ELEMENT Param (ParamName,ParamVal)+ >
<!ATTLIST Param paramInOut (In|Out) "In">

<!ELEMENT ParamName ( #PCDATA ) >

<!ELEMENT ParamVal ( #PCDATA ) >

]
>
<Report ver="2.0" tmZone="Eastern Standard Time">
<General productName="Micro Focus Unified Functional Testing" productVer="15.0.1" os="" host="BLSSTGATST2"><DocLocation><![CDATA[H:\HPA_Test\Test Resources_Claims\Scripts\Claims Smoke Test\TC_001_CLAIMS_SMOKETESTSUITE]]></DocLocation></General>
<Doc rID="T1"   productName= "Micro Focus Unified Functional Testing"  >
<DName><![CDATA[TC_001_CLAIMS_SMOKETESTSUITE]]></DName>
<Res><![CDATA[Report2]]></Res>
<DT rID="T2">
<NodeArgs eType="Table" icon="2" nRep="4" filter="False" >
<Disp><![CDATA[Run-Time Data Table]]></Disp>
<BtmPane vType="Table" >
<Path><![CDATA[Default.xlsx]]></Path>
</BtmPane>
</NodeArgs>
</DT>
<DIter rID="T3" iterID="1" >
<Action rID="T4">
<AName><![CDATA[Action1]]></AName>
<Action rID="T5">
<AName><![CDATA[Action1 [GlobalDriver_Working_Smoke]]]></AName>
<Step rID="T6">
<Obj plainTxt="False" ><![CDATA[LoadFunctionLibrary]]></Obj>
<Details plainTxt="False" ><![CDATA[LoadFunctionLibrary function passed]]></Details>
<Time><![CDATA[5/13/2022 - 8:07:08]]></Time>
<TimeTick>1652443628</TimeTick>
<NodeArgs eType="Replay" icon="6" nRep="9" status="Passed" Source="Action1 [GlobalDriver_Working_Smoke]" SourceLine="151" >
<Disp><![CDATA[LoadFunctionLibrary]]></Disp>
</NodeArgs>
</Step>
<Step rID="T7">
<Obj plainTxt="False" ><![CDATA[LoadFunctionLibrary]]></Obj>
<Details plainTxt="False" ><![CDATA[LoadFunctionLibrary function passed]]></Details>
<Time><![CDATA[5/13/2022 - 8:07:11]]></Time>
<TimeTick>1652443631</TimeTick>
<NodeArgs eType="Replay" icon="6" nRep="10" status="Passed" Source="Action1 [GlobalDriver_Working_Smoke]" SourceLine="153" >
<Disp><![CDATA[LoadFunctionLibrary]]></Disp>
</NodeArgs>
</Step>
<Step rID="T8">
<Obj plainTxt="False" ><![CDATA[LoadFunctionLibrary]]></Obj>
<Details plainTxt="False" ><![CDATA[LoadFunctionLibrary function passed]]></Details>
<Time><![CDATA[5/13/2022 - 8:07:11]]></Time>
<TimeTick>1652443631</TimeTick>
<NodeArgs eType="Replay" icon="6" nRep="11" status="Passed" Source="Action1 [GlobalDriver_Working_Smoke]" SourceLine="154" >
<Disp><![CDATA[LoadFunctionLibrary]]></Disp>
</NodeArgs>
</Step>
<Step rID="T9">
<Obj plainTxt="False" ><![CDATA[LoadFunctionLibrary]]></Obj>
<Details plainTxt="False" ><![CDATA[LoadFunctionLibrary function passed]]></Details>
<Time><![CDATA[5/13/2022 - 8:07:11]]></Time>
<TimeTick>1652443631</TimeTick>
<NodeArgs eType="Replay" icon="6" nRep="12" status="Passed" Source="Action1 [GlobalDriver_Working_Smoke]" SourceLine="155" >
<Disp><![CDATA[LoadFunctionLibrary]]></Disp>
</NodeArgs>
</Step>
<Step rID="T10">
<Obj ><![CDATA[Test Information]]></Obj>
<Details ><![CDATA[datasheetused:CLAIMS_SMOKETESTSUITE.xlsServer Used:hpasstgaweb1]]></Details>
<Time><![CDATA[5/13/2022 - 8:07:11]]></Time>
<TimeTick>1652443631</TimeTick>
<NodeArgs eType="User" icon="7" nRep="13" Source="Action1 [GlobalDriver_Working_Smoke]" SourceLine="167" >
<Disp><![CDATA[Test Information]]></Disp>
</NodeArgs>
</Step>
<Step rID="T11">
<Obj ><![CDATA[Find Row No]]></Obj>
<Details ><![CDATA[Row No ofTC_003_Carrier_ModifyEditSetting:917]]></Details>
<Time><![CDATA[5/13/2022 - 8:07:21]]></Time>
<TimeTick>1652443641</TimeTick>
<NodeArgs eType="User" icon="7" nRep="14" status="Passed" Source="Action1 [GlobalDriver_Working_Smoke]" SourceLine="456" >
<Disp><![CDATA[Find Row No]]></Disp>
</NodeArgs>
</Step>
<Step rID="T12">
<Obj ><![CDATA[Find Row No]]></Obj>
<Details ><![CDATA[Row No ofTC_003_Carrier_ModifyEditSetting_END:949]]></Details>
<Time><![CDATA[5/13/2022 - 8:07:30]]></Time>
<TimeTick>1652443650</TimeTick>
<NodeArgs eType="User" icon="7" nRep="15" status="Passed" Source="Action1 [GlobalDriver_Working_Smoke]" SourceLine="456" >
<Disp><![CDATA[Find Row No]]></Disp>
</NodeArgs>
</Step>
<Step rID="T13">
<Obj ><![CDATA[Find Row No]]></Obj>
<Details ><![CDATA[Row No ofLOGOFF:7]]></Details>
<Time><![CDATA[5/13/2022 - 8:07:36]]></Time>
<TimeTick>1652443656</TimeTick>
<NodeArgs eType="User" icon="7" nRep="16" status="Passed" Source="Action1 [GlobalDriver_Working_Smoke]" SourceLine="456" >
<Disp><![CDATA[Find Row No]]></Disp>
</NodeArgs>
</Step>
<Step rID="T14">
<Obj ><![CDATA[Find Row No]]></Obj>
<Details ><![CDATA[Row No ofLOGOFF_END:12]]></Details>
<Time><![CDATA[5/13/2022 - 8:07:41]]></Time>
<TimeTick>1652443661</TimeTick>
<NodeArgs eType="User" icon="7" nRep="17" status="Passed" Source="Action1 [GlobalDriver_Working_Smoke]" SourceLine="456" >
<Disp><![CDATA[Find Row No]]></Disp>
</NodeArgs>
</Step>
<Step rID="T15">
<Obj plainTxt="False" ><![CDATA[SystemUtil]]></Obj>
<Details plainTxt="False" ><![CDATA[SystemUtil]]></Details>
<Time><![CDATA[5/13/2022 - 8:07:49]]></Time>
<TimeTick>1652443669</TimeTick>
<Step rID="T16">
<Obj plainTxt="False" ><![CDATA[Run "iexplore.exe",1]]></Obj>
<Details plainTxt="False" ><![CDATA[Run "iexplore.exe",1]]></Details>
<Time><![CDATA[5/13/2022 - 8:07:49]]></Time>
<TimeTick>1652443669</TimeTick>
<NodeArgs eType="Replay" icon="8" nRep="21" status="Passed" >
<Disp><![CDATA[Run "iexplore.exe",1]]></Disp>
</NodeArgs>
</Step>
<NodeArgs eType="Replay" icon="8" nRep="20" status="Passed" >
<Disp><![CDATA[SystemUtil]]></Disp>
</NodeArgs>
</Step>
<Step rID="T17">
<Obj ><![CDATA[Launch application]]></Obj>
<Details ><![CDATA[Application launched successfully:http://hpasstgaweb2.stga.mapshc.com/HPAALL/HPA/Master/Qmain.aspx]]></Details>
<Time><![CDATA[5/13/2022 - 8:07:55]]></Time>
<TimeTick>1652443675</TimeTick>
<NodeArgs eType="User" icon="7" nRep="22" status="Passed" >
<Disp><![CDATA[Launch application]]></Disp>
</NodeArgs>
</Step>
<Step rID="T18">
<Obj ><![CDATA[NA]]></Obj>
<Details ><![CDATA[Succeded at Row No:    1,Value used:http://hpasstgaweb2.stga.mapshc.com/HPAALL/HPA/Master/Qmain.aspx]]></Details>
<Time><![CDATA[5/13/2022 - 8:07:55]]></Time>
<TimeTick>1652443675</TimeTick>
<NodeArgs eType="User" icon="7" nRep="23" Source="Action1 [GlobalDriver_Working_Smoke]" SourceLine="1627" >
<Disp><![CDATA[NA]]></Disp>
</NodeArgs>
</Step>
<Step rID="T19">
<Obj ><![CDATA[NA]]></Obj>
<Details ><![CDATA[Succeded at Row No:    2,Value used:10]]></Details>
<Time><![CDATA[5/13/2022 - 8:08:06]]></Time>
<TimeTick>1652443686</TimeTick>
<NodeArgs eType="User" icon="7" nRep="24" Source="Action1 [GlobalDriver_Working_Smoke]" SourceLine="1627" >
<Disp><![CDATA[NA]]></Disp>
</NodeArgs>
</Step>
<Step rID="T20">
<Obj ><![CDATA[Skip row]]></Obj>
<Details ><![CDATA[You have successfully skipped the row no 1]]></Details>
<Time><![CDATA[5/13/2022 - 8:08:07]]></Time>
<TimeTick>1652443687</TimeTick>
<NodeArgs eType="User" icon="7" nRep="25" Source="Action1 [GlobalDriver_Working_Smoke]" SourceLine="563" >
<Disp><![CDATA[Skip row]]></Disp>
</NodeArgs>
</Step>
<Step rID="T21">
<Obj ><![CDATA[Skip row]]></Obj>
<Details ><![CDATA[You have successfully skipped the row no 1]]></Details>
<Time><![CDATA[5/13/2022 - 8:08:08]]></Time>
<TimeTick>1652443688</TimeTick>
<NodeArgs eType="User" icon="7" nRep="26" Source="Action1 [GlobalDriver_Working_Smoke]" SourceLine="563" >
<Disp><![CDATA[Skip row]]></Disp>
</NodeArgs>
</Step>
<Step rID="T22">
<Obj plainTxt="False" ><![CDATA[Brw_Home_Page]]></Obj>
<Details plainTxt="False" ><![CDATA[<table><tr><td><span style="text-align : left; font-size : 12px; ">Local Browser</span></td></tr></table>]]></Details>
<Time><![CDATA[5/13/2022 - 8:08:09]]></Time>
<TimeTick>1652443689</TimeTick>
<Step rID="T23">
<Obj plainTxt="False" ><![CDATA[Pge_QNXT_Home_Page]]></Obj>
<Details plainTxt="False" ><![CDATA[Page]]></Details>
<Time><![CDATA[5/13/2022 - 8:08:09]]></Time>
<TimeTick>1652443689</TimeTick>
<Step rID="T24">
<Obj plainTxt="False" ><![CDATA[Lst_Working_Env.Exist]]></Obj>
<Details plainTxt="False" ><![CDATA["Object exists"]]></Details>
<Time><![CDATA[5/13/2022 - 8:08:09]]></Time>
<TimeTick>1652443689</TimeTick>
<NodeArgs eType="Replay" icon="11" nRep="30" >
<Disp><![CDATA[Lst_Working_Env.Exist]]></Disp>
<BtmPane vType="Mercury.SSHWeb" >
<Path><![CDATA[ZIP::Act2\Row0\ssf3.xml]]></Path>
<ASHilite><![CDATA[Browser("Brw Home Page").Page("Pge QNXT Home Page").WebList("Lst Working Env")]]></ASHilite>
</BtmPane>
</NodeArgs>
</Step>
<Step rID="T25">
<Obj plainTxt="False" ><![CDATA[Lst_Working_Env.Select]]></Obj>
<Details plainTxt="False" ><![CDATA["HPA-Med/Dent"]]></Details>
<Time><![CDATA[5/13/2022 - 8:08:09]]></Time>
<TimeTick>1652443689</TimeTick>
<NodeArgs eType="Replay" icon="11" nRep="33" >
<Disp><![CDATA[Lst_Working_Env.Select]]></Disp>
<BtmPane vType="Mercury.SSHWeb" >
<Path><![CDATA[ZIP::Act2\Row0\ssf4.xml]]></Path>
<ASHilite><![CDATA[Browser("Brw Home Page").Page("Pge QNXT Home Page").WebList("Lst Working Env")]]></ASHilite>
</BtmPane>
</NodeArgs>
</Step>
<NodeArgs eType="Context" icon="10" nRep="29" >
<Disp><![CDATA[Pge_QNXT_Home_Page]]></Disp>
<BtmPane vType="HTMLSNSH" >
<Path><![CDATA[ZIP::Act2\Row0\ssf2.xml]]></Path>
<ASHilite><![CDATA[Browser("Brw_Home_Page").Page("Pge_QNXT_Home_Page")]]></ASHilite>
</BtmPane>
</NodeArgs>
</Step>
<NodeArgs eType="Context" icon="9" nRep="28" >
<Disp><![CDATA[Brw_Home_Page]]></Disp>
<BtmPane vType="ViewerGen.SSViewerGen" >
<Path><![CDATA[ZIP::Act2\Row0\ssf1.xml]]></Path>
<ASHilite><![CDATA[14026654]]></ASHilite>
</BtmPane>
</NodeArgs>
</Step>
<Step rID="T26">
<Obj ><![CDATA[Working_Env]]></Obj>
<Details ><![CDATA[Succeded at Row No:    5,Value used:HPA-Med/Dent]]></Details>
<Time><![CDATA[5/13/2022 - 8:08:10]]></Time>
<TimeTick>1652443690</TimeTick>
<NodeArgs eType="User" icon="7" nRep="34" Source="Action1 [GlobalDriver_Working_Smoke]" SourceLine="1627" >
<Disp><![CDATA[Working_Env]]></Disp>
</NodeArgs>
</Step>
<Step rID="T27">
<Obj plainTxt="False" ><![CDATA[Brw_Home_Page]]></Obj>
<Details plainTxt="False" ><![CDATA[<table><tr><td><span style="text-align : left; font-size : 12px; ">Local Browser</span></td></tr></table>]]></Details>
<Time><![CDATA[5/13/2022 - 8:08:11]]></Time>
<TimeTick>1652443691</TimeTick>
<Step rID="T28">
<Obj plainTxt="False" ><![CDATA[Pge_QNXT_Home_Page]]></Obj>
<Details plainTxt="False" ><![CDATA[Page]]></Details>
<Time><![CDATA[5/13/2022 - 8:08:11]]></Time>
<TimeTick>1652443691</TimeTick>
<Step rID="T29">
<Obj plainTxt="False" ><![CDATA[Lnk_Carriers/ Programs.Exist]]></Obj>
<Details plainTxt="False" ><![CDATA["Object exists"]]></Details>
<Time><![CDATA[5/13/2022 - 8:08:11]]></Time>
<TimeTick>1652443691</TimeTick>
<NodeArgs eType="Replay" icon="12" nRep="38" >
<Disp><![CDATA[Lnk_Carriers/ Programs.Exist]]></Disp>
<BtmPane vType="Mercury.SSHWeb" >
<Path><![CDATA[ZIP::Act2\Row0\ssf7.xml]]></Path>
<ASHilite><![CDATA[Browser("Brw Home Page").Page("Pge QNXT Home Page").Link("Lnk Carriers/ Programs")]]></ASHilite>
</BtmPane>
</NodeArgs>
</Step>
<Step rID="T30">
<Obj plainTxt="False" ><![CDATA[Lnk_Carriers/ Programs.Click]]></Obj>
<Details plainTxt="False" ><![CDATA[]]></Details>
<Time><![CDATA[5/13/2022 - 8:08:11]]></Time>
<TimeTick>1652443691</TimeTick>
<NodeArgs eType="Replay" icon="12" nRep="41" >
<Disp><![CDATA[Lnk_Carriers/ Programs.Click]]></Disp>
<BtmPane vType="Mercury.SSHWeb" >
<Path><![CDATA[ZIP::Act2\Row0\ssf8.xml]]></Path>
<ASHilite><![CDATA[Browser("Brw Home Page").Page("Pge QNXT Home Page").Link("Lnk Carriers/ Programs")]]></ASHilite>
</BtmPane>
</NodeArgs>
</Step>
<NodeArgs eType="Context" icon="10" nRep="37" >
<Disp><![CDATA[Pge_QNXT_Home_Page]]></Disp>
<BtmPane vType="HTMLSNSH" >
<Path><![CDATA[ZIP::Act2\Row0\ssf6.xml]]></Path>
<ASHilite><![CDATA[Browser("Brw_Home_Page").Page("Pge_QNXT_Home_Page")]]></ASHilite>
</BtmPane>
</NodeArgs>
</Step>
<NodeArgs eType="Context" icon="9" nRep="36" >
<Disp><![CDATA[Brw_Home_Page]]></Disp>
<BtmPane vType="ViewerGen.SSViewerGen" >
<Path><![CDATA[ZIP::Act2\Row0\ssf5.xml]]></Path>
<ASHilite><![CDATA[14026654]]></ASHilite>
</BtmPane>
</NodeArgs>
</Step>
<Step rID="T31">
<Obj ><![CDATA[Carriers/ Programs]]></Obj>
<Details ><![CDATA[Succeded at Row No:    917]]></Details>
<Time><![CDATA[5/13/2022 - 8:08:12]]></Time>
<TimeTick>1652443692</TimeTick>
<NodeArgs eType="User" icon="7" nRep="42" Source="Action1 [GlobalDriver_Working_Smoke]" SourceLine="1625" >
<Disp><![CDATA[Carriers/ Programs]]></Disp>
</NodeArgs>
</Step>
<Step rID="T32">
<Obj ><![CDATA[NA]]></Obj>
<Details ><![CDATA[Succeded at Row No:    918,Value used:3]]></Details>
<Time><![CDATA[5/13/2022 - 8:08:16]]></Time>
<TimeTick>1652443696</TimeTick>
<NodeArgs eType="User" icon="7" nRep="43" Source="Action1 [GlobalDriver_Working_Smoke]" SourceLine="1627" >
<Disp><![CDATA[NA]]></Disp>
</NodeArgs>
</Step>
<Step rID="T33">
<Obj ><![CDATA[NA]]></Obj>
<Details ><![CDATA[Succeded at Row No:    919]]></Details>
<Time><![CDATA[5/13/2022 - 8:08:24]]></Time>
<TimeTick>1652443704</TimeTick>
<NodeArgs eType="User" icon="7" nRep="44" Source="Action1 [GlobalDriver_Working_Smoke]" SourceLine="1625" >
<Disp><![CDATA[NA]]></Disp>
</NodeArgs>
</Step>
<Step rID="T34">
<Obj ><![CDATA[NA]]></Obj>
<Details ><![CDATA[Succeded at Row No:    920,Value used:3]]></Details>
<Time><![CDATA[5/13/2022 - 8:08:28]]></Time>
<TimeTick>1652443708</TimeTick>
<NodeArgs eType="User" icon="7" nRep="45" Source="Action1 [GlobalDriver_Working_Smoke]" SourceLine="1627" >
<Disp><![CDATA[NA]]></Disp>
</NodeArgs>
</Step>
<Step rID="T35">
<Obj plainTxt="False" ><![CDATA[Brw_Carriers/Programs]]></Obj>
<Details plainTxt="False" ><![CDATA[<table><tr><td><span style="text-align : left; font-size : 12px; ">Local Browser</span></td></tr></table>]]></Details>
<Time><![CDATA[5/13/2022 - 8:08:29]]></Time>
<TimeTick>1652443709</TimeTick>
<Step rID="T36">
<Obj plainTxt="False" ><![CDATA[Pge_Carriers/Programs]]></Obj>
<Details plainTxt="False" ><![CDATA[Page]]></Details>
<Time><![CDATA[5/13/2022 - 8:08:29]]></Time>
<TimeTick>1652443709</TimeTick>
<Step rID="T37">
<Obj plainTxt="False" ><![CDATA[Elm_Health_Plans.Exist]]></Obj>
<Details plainTxt="False" ><![CDATA["Object exists"]]></Details>
<Time><![CDATA[5/13/2022 - 8:08:29]]></Time>
<TimeTick>1652443709</TimeTick>
<NodeArgs eType="Replay" icon="13" nRep="49" >
<Disp><![CDATA[Elm_Health_Plans.Exist]]></Disp>
<BtmPane vType="Mercury.SSHWeb" >
<Path><![CDATA[ZIP::Act2\Row0\ssf11.xml]]></Path>
<ASHilite><![CDATA[Browser("Brw Carriers/Programs").Page("Pge Carriers/Programs").WebElement("Elm Health Plans")]]></ASHilite>
</BtmPane>
</NodeArgs>
</Step>
<Step rID="T38">
<Obj plainTxt="False" ><![CDATA[Elm_Health_Plans.Click]]></Obj>
<Details plainTxt="False" ><![CDATA[]]></Details>
<Time><![CDATA[5/13/2022 - 8:08:30]]></Time>
<TimeTick>1652443710</TimeTick>
<NodeArgs eType="Replay" icon="13" nRep="52" >
<Disp><![CDATA[Elm_Health_Plans.Click]]></Disp>
<BtmPane vType="Mercury.SSHWeb" >
<Path><![CDATA[ZIP::Act2\Row0\ssf12.xml]]></Path>
<ASHilite><![CDATA[Browser("Brw Carriers/Programs").Page("Pge Carriers/Programs").WebElement("Elm Health Plans")]]></ASHilite>
</BtmPane>
</NodeArgs>
</Step>
<NodeArgs eType="Context" icon="10" nRep="48" >
<Disp><![CDATA[Pge_Carriers/Programs]]></Disp>
<BtmPane vType="HTMLSNSH" >
<Path><![CDATA[ZIP::Act2\Row0\ssf10.xml]]></Path>
<ASHilite><![CDATA[Browser("Brw_Carriers/Programs").Page("Pge_Carriers/Programs")]]></ASHilite>
</BtmPane>
</NodeArgs>
</Step>
<NodeArgs eType="Context" icon="9" nRep="47" >
<Disp><![CDATA[Brw_Carriers/Programs]]></Disp>
<BtmPane vType="ViewerGen.SSViewerGen" >
<Path><![CDATA[ZIP::Act2\Row0\ssf9.xml]]></Path>
<ASHilite><![CDATA[133084]]></ASHilite>
</BtmPane>
</NodeArgs>
</Step>
<Step rID="T39">
<Obj ><![CDATA[Health_Plans]]></Obj>
<Details ><![CDATA[Succeded at Row No:    921]]></Details>
<Time><![CDATA[5/13/2022 - 8:08:30]]></Time>
<TimeTick>1652443710</TimeTick>
<NodeArgs eType="User" icon="7" nRep="53" Source="Action1 [GlobalDriver_Working_Smoke]" SourceLine="1625" >
<Disp><![CDATA[Health_Plans]]></Disp>
</NodeArgs>
</Step>
<Step rID="T40">
<Obj plainTxt="False" ><![CDATA[Brw_Carriers/Programs]]></Obj>
<Details plainTxt="False" ><![CDATA[<table><tr><td><span style="text-align : left; font-size : 12px; ">Local Browser</span></td></tr></table>]]></Details>
<Time><![CDATA[5/13/2022 - 8:08:31]]></Time>
<TimeTick>1652443711</TimeTick>
<Step rID="T41">
<Obj plainTxt="False" ><![CDATA[Pge_Carriers/Programs]]></Obj>
<Details plainTxt="False" ><![CDATA[Page]]></Details>
<Time><![CDATA[5/13/2022 - 8:08:31]]></Time>
<TimeTick>1652443711</TimeTick>
<Step rID="T42">
<Obj plainTxt="False" ><![CDATA[Frm_Carriers/Programs_HealthPlans]]></Obj>
<Details plainTxt="False" ><![CDATA[Frame]]></Details>
<Time><![CDATA[5/13/2022 - 8:08:31]]></Time>
<TimeTick>1652443711</TimeTick>
<Step rID="T43">
<Obj plainTxt="False" ><![CDATA[Lst_HealthPlans.Exist]]></Obj>
<Details plainTxt="False" ><![CDATA["Object exists"]]></Details>
<Time><![CDATA[5/13/2022 - 8:08:31]]></Time>
<TimeTick>1652443711</TimeTick>
<NodeArgs eType="Replay" icon="11" nRep="58" >
<Disp><![CDATA[Lst_HealthPlans.Exist]]></Disp>
<BtmPane vType="Mercury.SSHWeb" >
<Path><![CDATA[ZIP::Act2\Row0\ssf16.xml]]></Path>
<ASHilite><![CDATA[Browser("Brw Carriers/Programs").Page("Pge Carriers/Programs").Frame("Frm Carriers/Programs HealthPlans").WebList("Lst HealthPlans")]]></ASHilite>
</BtmPane>
</NodeArgs>
</Step>
<Step rID="T44">
<Obj plainTxt="False" ><![CDATA[Lst_HealthPlans.Select]]></Obj>
<Details plainTxt="False" ><![CDATA["Department of Medicaid Services"]]></Details>
<Time><![CDATA[5/13/2022 - 8:08:31]]></Time>
<TimeTick>1652443711</TimeTick>
<NodeArgs eType="Replay" icon="11" nRep="62" >
<Disp><![CDATA[Lst_HealthPlans.Select]]></Disp>
<BtmPane vType="Mercury.SSHWeb" >
<Path><![CDATA[ZIP::Act2\Row0\ssf17.xml]]></Path>
<ASHilite><![CDATA[Browser("Brw Carriers/Programs").Page("Pge Carriers/Programs").Frame("Frm Carriers/Programs HealthPlans").WebList("Lst HealthPlans")]]></ASHilite>
</BtmPane>
</NodeArgs>
</Step>
<NodeArgs eType="Context" icon="14" nRep="57" >
<Disp><![CDATA[Frm_Carriers/Programs_HealthPlans]]></Disp>
<BtmPane vType="Mercury.SSHWeb" >
<Path><![CDATA[ZIP::Act2\Row0\ssf15.xml]]></Path>
<ASHilite><![CDATA[Browser("Brw Carriers/Programs").Page("Pge Carriers/Programs").Frame("Frm Carriers/Programs HealthPlans")]]></ASHilite>
</BtmPane>
</NodeArgs>
</Step>
<NodeArgs eType="Context" icon="10" nRep="56" >
<Disp><![CDATA[Pge_Carriers/Programs]]></Disp>
<BtmPane vType="HTMLSNSH" >
<Path><![CDATA[ZIP::Act2\Row0\ssf14.xml]]></Path>
<ASHilite><![CDATA[Browser("Brw_Carriers/Programs").Page("Pge_Carriers/Programs")]]></ASHilite>
</BtmPane>
</NodeArgs>
</Step>
<NodeArgs eType="Context" icon="9" nRep="55" >
<Disp><![CDATA[Brw_Carriers/Programs]]></Disp>
<BtmPane vType="ViewerGen.SSViewerGen" >
<Path><![CDATA[ZIP::Act2\Row0\ssf13.xml]]></Path>
<ASHilite><![CDATA[133084]]></ASHilite>
</BtmPane>
</NodeArgs>
</Step>
<Step rID="T45">
<Obj ><![CDATA[HealthPlans]]></Obj>
<Details ><![CDATA[Succeded at Row No:    922,Value used:Department of Medicaid Services]]></Details>
<Time><![CDATA[5/13/2022 - 8:08:32]]></Time>
<TimeTick>1652443712</TimeTick>
<NodeArgs eType="User" icon="7" nRep="63" Source="Action1 [GlobalDriver_Working_Smoke]" SourceLine="1627" >
<Disp><![CDATA[HealthPlans]]></Disp>
</NodeArgs>
</Step>
<Step rID="T46">
<Obj plainTxt="False" ><![CDATA[Brw_Carriers/Programs]]></Obj>
<Details plainTxt="False" ><![CDATA[<table><tr><td><span style="text-align : left; font-size : 12px; ">Local Browser</span></td></tr></table>]]></Details>
<Time><![CDATA[5/13/2022 - 8:08:33]]></Time>
<TimeTick>1652443713</TimeTick>
<Step rID="T47">
<Obj plainTxt="False" ><![CDATA[Pge_Carriers/Programs]]></Obj>
<Details plainTxt="False" ><![CDATA[Page]]></Details>
<Time><![CDATA[5/13/2022 - 8:08:33]]></Time>
<TimeTick>1652443713</TimeTick>
<Step rID="T48">
<Obj plainTxt="False" ><![CDATA[Frm_Carriers/Programs_HealthPlans]]></Obj>
<Details plainTxt="False" ><![CDATA[Frame]]></Details>
<Time><![CDATA[5/13/2022 - 8:08:33]]></Time>
<TimeTick>1652443713</TimeTick>
<Step rID="T49">
<Obj plainTxt="False" ><![CDATA[Wtbl_Program.Exist]]></Obj>
<Details plainTxt="False" ><![CDATA["Object exists"]]></Details>
<Time><![CDATA[5/13/2022 - 8:08:33]]></Time>
<TimeTick>1652443713</TimeTick>
<NodeArgs eType="Replay" icon="15" nRep="68" >
<Disp><![CDATA[Wtbl_Program.Exist]]></Disp>
<BtmPane vType="Mercury.SSHWeb" >
<Path><![CDATA[ZIP::Act2\Row0\ssf21.xml]]></Path>
<ASHilite><![CDATA[Browser("Brw Carriers/Programs").Page("Pge Carriers/Programs").Frame("Frm Carriers/Programs HealthPlans").WebTable("Wtbl Program")]]></ASHilite>
</BtmPane>
</NodeArgs>
</Step>
<Step rID="T50">
<Obj plainTxt="False" ><![CDATA["Wtbl_Program":Function Call]]></Obj>
<Details plainTxt="False" ><![CDATA[GetRowWithCellText]]></Details>
<Time><![CDATA[5/13/2022 - 8:08:33]]></Time>
<TimeTick>1652443713</TimeTick>
<NodeArgs eType="General" icon="15" nRep="70" status="Passed" >
<Disp><![CDATA["Wtbl_Program":Function Call]]></Disp>
<BtmPane vType="Mercury.SSHWeb" >
<Path><![CDATA[ZIP::Act2\Row0\ssf22.xml]]></Path>
<ASHilite><![CDATA[Browser("Brw Carriers/Programs").Page("Pge Carriers/Programs").Frame("Frm Carriers/Programs HealthPlans").WebTable("Wtbl Program")]]></ASHilite>
</BtmPane>
</NodeArgs>
</Step>
<Step rID="T51">
<Obj plainTxt="False" ><![CDATA["Wtbl_Program":Function Call]]></Obj>
<Details plainTxt="False" ><![CDATA[CellText]]></Details>
<Time><![CDATA[5/13/2022 - 8:08:33]]></Time>
<TimeTick>1652443713</TimeTick>
<NodeArgs eType="General" icon="15" nRep="72" >
<Disp><![CDATA["Wtbl_Program":Function Call]]></Disp>
<BtmPane vType="Mercury.SSHWeb" >
<Path><![CDATA[ZIP::Act2\Row0\ssf23.xml]]></Path>
<ASHilite><![CDATA[Browser("Brw Carriers/Programs").Page("Pge Carriers/Programs").Frame("Frm Carriers/Programs HealthPlans").WebTable("Wtbl Program")]]></ASHilite>
</BtmPane>
</NodeArgs>
</Step>
<Step rID="T52">
<Obj plainTxt="False" ><![CDATA["Wtbl_Program":Function Call]]></Obj>
<Details plainTxt="False" ><![CDATA[ColumnCount]]></Details>
<Time><![CDATA[5/13/2022 - 8:08:33]]></Time>
<TimeTick>1652443713</TimeTick>
<NodeArgs eType="General" icon="15" nRep="74" >
<Disp><![CDATA["Wtbl_Program":Function Call]]></Disp>
<BtmPane vType="Mercury.SSHWeb" >
<Path><![CDATA[ZIP::Act2\Row0\ssf24.xml]]></Path>
<ASHilite><![CDATA[Browser("Brw Carriers/Programs").Page("Pge Carriers/Programs").Frame("Frm Carriers/Programs HealthPlans").WebTable("Wtbl Program")]]></ASHilite>
</BtmPane>
</NodeArgs>
</Step>
<Step rID="T53">
<Obj plainTxt="False" ><![CDATA["Wtbl_Program":Function Call]]></Obj>
<Details plainTxt="False" ><![CDATA[ChildItemCount]]></Details>
<Time><![CDATA[5/13/2022 - 8:08:33]]></Time>
<TimeTick>1652443713</TimeTick>
<NodeArgs eType="General" icon="15" nRep="76" >
<Disp><![CDATA["Wtbl_Program":Function Call]]></Disp>
<BtmPane vType="Mercury.SSHWeb" >
<Path><![CDATA[ZIP::Act2\Row0\ssf25.xml]]></Path>
<ASHilite><![CDATA[Browser("Brw Carriers/Programs").Page("Pge Carriers/Programs").Frame("Frm Carriers/Programs HealthPlans").WebTable("Wtbl Program")]]></ASHilite>
</BtmPane>
</NodeArgs>
</Step>
<Step rID="T54">
<Obj plainTxt="False" ><![CDATA["Wtbl_Program":Function Call]]></Obj>
<Details plainTxt="False" ><![CDATA[ChildItem]]></Details>
<Time><![CDATA[5/13/2022 - 8:08:34]]></Time>
<TimeTick>1652443714</TimeTick>
<NodeArgs eType="General" icon="15" nRep="78" >
<Disp><![CDATA["Wtbl_Program":Function Call]]></Disp>
<BtmPane vType="Mercury.SSHWeb" >
<Path><![CDATA[ZIP::Act2\Row0\ssf26.xml]]></Path>
<ASHilite><![CDATA[Browser("Brw Carriers/Programs").Page("Pge Carriers/Programs").Frame("Frm Carriers/Programs HealthPlans").WebTable("Wtbl Program")]]></ASHilite>
</BtmPane>
</NodeArgs>
</Step>
<Step rID="T55">
<Obj plainTxt="False" ><![CDATA[[ radFeeMain ].Select]]></Obj>
<Details plainTxt="False" ><![CDATA["#4"]]></Details>
<Time><![CDATA[5/13/2022 - 8:08:34]]></Time>
<TimeTick>1652443714</TimeTick>
<NodeArgs eType="Replay" icon="16" nRep="80" >
<Disp><![CDATA[[ radFeeMain ].Select]]></Disp>
<BtmPane vType="Mercury.SSHWeb" >
<Path><![CDATA[ZIP::Act2\Row0\ssf27.xml]]></Path>
<ASHilite><![CDATA[HIGHLIGHT PARAMS]]></ASHilite>
</BtmPane>
</NodeArgs>
</Step>
<NodeArgs eType="Context" icon="14" nRep="67" status="Passed" >
<Disp><![CDATA[Frm_Carriers/Programs_HealthPlans]]></Disp>
<BtmPane vType="Mercury.SSHWeb" >
<Path><![CDATA[ZIP::Act2\Row0\ssf20.xml]]></Path>
<ASHilite><![CDATA[Browser("Brw Carriers/Programs").Page("Pge Carriers/Programs").Frame("Frm Carriers/Programs HealthPlans")]]></ASHilite>
</BtmPane>
</NodeArgs>
</Step>
<NodeArgs eType="Context" icon="10" nRep="66" status="Passed" >
<Disp><![CDATA[Pge_Carriers/Programs]]></Disp>
<BtmPane vType="HTMLSNSH" >
<Path><![CDATA[ZIP::Act2\Row0\ssf19.xml]]></Path>
<ASHilite><![CDATA[Browser("Brw_Carriers/Programs").Page("Pge_Carriers/Programs")]]></ASHilite>
</BtmPane>
</NodeArgs>
</Step>
<NodeArgs eType="Context" icon="9" nRep="65" status="Passed" >
<Disp><![CDATA[Brw_Carriers/Programs]]></Disp>
<BtmPane vType="ViewerGen.SSViewerGen" >
<Path><![CDATA[ZIP::Act2\Row0\ssf18.xml]]></Path>
<ASHilite><![CDATA[133084]]></ASHilite>
</BtmPane>
</NodeArgs>
</Step>
<Step rID="T56">
<Obj ><![CDATA[Program]]></Obj>
<Details ><![CDATA[Succeded at Row No:    923,Value used:2;CHIP MCO]]></Details>
<Time><![CDATA[5/13/2022 - 8:08:34]]></Time>
<TimeTick>1652443714</TimeTick>
<NodeArgs eType="User" icon="7" nRep="81" Source="Action1 [GlobalDriver_Working_Smoke]" SourceLine="1627" >
<Disp><![CDATA[Program]]></Disp>
</NodeArgs>
</Step>
<Step rID="T57">